{
  "$schema": "https://json-schema.org/draft/2020-12/schema",
  "type": "object",
  "properties": {
    "name": {
      "description": "Layout name",
      "type": "string"
    },
    "deviceName": {
      "description": "Exact string to match against deviceName",
      "type": "string"
    },
    "pattern": {
      "description": "Regex pattern to match against deviceName",
      "type": "string"
    },
    "viewport": {
      "description": "Viewport size",
      "type": "array",
      "items": [
        {
          "description": "Width",
          "type": "number"
        },
        {
          "description": "Height",
          "type": "number"
        }
      ],
      "minItems": 2,
      "maxItems": 2
    },
    "buttons": {
      "description": "Physical button layout",
      "type": "array",
      "items": {
        "type": "array",
        "prefixItems": [
          { "$ref": "#/$defs/button" },
          {
            "description": "X position",
            "type": ["number", "string"]
          },
          {
            "description": "Y position",
            "type": ["number", "string"]
          }
        ],
        "minItems": 3,
        "items": false
      }
    },
    "modes": {
      "description": "Mode configuration",
      "type": "object",
      "propertyNames": {
        "$ref": "#/$defs/mode"
      },
      "additionalProperties": {
        "type": "object",
        "properties": {
          "bindings": {
            "description": "Button bindings",
            "type": "array",
            "items": {
              "type": "array",
              "prefixItems": [
                { "$ref": "#/$defs/button" },
                { "$ref": "#/$defs/binding" },
                { "$ref": "#/$defs/bindingVisibility" }
              ],
              "minItems": 2,
              "maxItems": 3,
              "items": false
            }
          },
          "socd": {
            "description": "SOCD configuration",
            "type": "array",
            "items": {
              "type": "array",
              "prefixItems": [
                { "$ref": "#/$defs/binding" },
                { "$ref": "#/$defs/binding" },
                { "$ref": "#/$defs/socdType" }
              ],
              "minItems": 3,
              "items": false
            }
          },
          "additionalProperties": false
        }
      }
    },
    "additionalProperties": false
  },
  "required": ["name"],
  "oneOf": [{ "required": ["deviceName"] }, { "required": ["pattern"] }],
  "$defs": {
    "button": {
      "description": "Physical button ID",
      "enum": [
        0, "0", 1, "1", 2, "2", 3, "3", 4, "4", 5, "5", 6, "6", 7, "7", 8, "8", 9, "9", 10, "10", 11, "11", 12, "12", 13, "13", 14, "14",
        15, "15", 16, "16", 17, "17", 18, "18", 19, "19", 20, "20", 21, "21", 22, "22", 23, "23", 24, "24", 25, "25", 26, "26", 27, "27", 28, "28",
        29, "29", 30, "30", 31, "31", 32, "32", 33, "33", 34, "34", 35, "35", 36, "36", 37, "37", 38, "38", 39, "39", 40, "40", 41, "41", 42, "42",
        43, "43", 44, "44", 45, "45", 46, "46", 47, "47", 48, "48", 49, "49", 50, "50", 51, "51", 52, "52", 53, "53", 54, "54", 55, "55", 56, "56",
        57, "57", 58, "58", 59, "59"
      ]
    },
    "mode": {
      "description": "Mode ID",
      "enum": ["melee", "project_m", "ultimate", "fgc", "rivals_of_aether", "rivals_of_aether_2", "keyboard", "custom"]
    },
    "bindingVisibility": {
      "description": "Binding visibility",
      "enum": ["hidden"]
    },
    "binding": {
      "description": "Binding ID",
      "enum": [
        "a",
        "b",
        "x",
        "y",
        "z",
        "left_shoulder",
        "right_shoulder",
        "left_trigger",
        "right_trigger",
        "start",
        "select",
        "home",
        "capture",
        "mx",
        "my",
        "dpad_mod",
        "dpad_up",
        "dpad_down",
        "dpad_left",
        "dpad_right",
        "left_stick_click",
        "left_stick_up",
        "left_stick_down",
        "left_stick_left",
        "left_stick_right",
        "right_stick_click",
        "right_stick_up",
        "right_stick_down",
        "right_stick_left",
        "right_stick_right",
        "light_shield",
        "medium_shield",
        "kb_a",
        "kb_b",
        "kb_c",
        "kb_d",
        "kb_e",
        "kb_f",
        "kb_g",
        "kb_h",
        "kb_i",
        "kb_j",
        "kb_k",
        "kb_l",
        "kb_m",
        "kb_n",
        "kb_o",
        "kb_p",
        "kb_q",
        "kb_r",
        "kb_s",
        "kb_t",
        "kb_u",
        "kb_v",
        "kb_w",
        "kb_x",
        "kb_y",
        "kb_z"
      ]
    },
    "socdType": {
      "description": "SOCD type",
      "enum": [
        "neutral",
        "second_input",
        "second_input_no_reactivation",
        "direction_1_priority",
        "direction_2_priority"
      ]
    }
  }
}
