{
  "$schema": "../layout_schema.json",
  "name": "PRI$M",
  "deviceName": "GRAM PRI$M",
  "viewport": [1000, 600],
  "modes": {
    "melee": {
      "bindings": [
        ["3", "left_trigger"],
        ["2", "left_stick_left"],
        ["1", "left_stick_down"],
        ["0", "left_stick_right"],
        ["48", "start"],
        ["32", "mx"],
        ["33", "my"],
        ["20", "right_trigger"],
        ["21", "y"],
        ["22", "light_shield"],
        ["23", "medium_shield"],
        ["16", "b"],
        ["17", "x"],
        ["18", "z"],
        ["19", "left_stick_up"],
        ["40", "a"],
        ["43", "right_stick_up"],
        ["44", "right_stick_right"],
        ["42", "right_stick_left"],
        ["41", "right_stick_down"]
      ],
      "socd": [
        ["left_stick_left", "left_stick_right", "second_input_no_reactivation"],
        ["left_stick_up", "left_stick_down", "second_input_no_reactivation"],
        ["right_stick_left", "right_stick_right", "second_input_no_reactivation"],
        ["right_stick_up", "right_stick_down", "second_input_no_reactivation"]
      ]
    },
    "project_m": {
      "bindings": [
        ["3", "left_trigger"],
        ["2", "left_stick_left"],
        ["1", "left_stick_down"],
        ["0", "left_stick_right"],
        ["48", "start"],
        ["32", "mx"],
        ["33", "my"],
        ["20", "right_trigger"],
        ["21", "y"],
        ["22", "light_shield"],
        ["23", "dpad_up"],
        ["16", "b"],
        ["17", "x"],
        ["18", "z"],
        ["19", "left_stick_up"],
        ["40", "a"],
        ["43", "right_stick_up"],
        ["44", "right_stick_right"],
        ["42", "right_stick_left"],
        ["41", "right_stick_down"]
      ],
      "socd": [
        ["left_stick_left", "left_stick_right", "second_input_no_reactivation"],
        ["left_stick_up", "left_stick_down", "second_input_no_reactivation"],
        ["right_stick_left", "right_stick_right", "second_input_no_reactivation"],
        ["right_stick_up", "right_stick_down", "second_input_no_reactivation"]
      ]
    },
    "ultimate": {
      "bindings": [
        ["3", "left_trigger"],
        ["2", "left_stick_left"],
        ["1", "left_stick_down"],
        ["0", "left_stick_right"],
        ["48", "start"],
        ["32", "mx"],
        ["33", "my"],
        ["20", "right_trigger"],
        ["21", "y"],
        ["22", "right_shoulder"],
        ["23", "left_shoulder"],
        ["16", "b"],
        ["17", "x"],
        ["18", "right_shoulder"],
        ["19", "left_stick_up"],
        ["40", "a"],
        ["43", "right_stick_up"],
        ["44", "right_stick_right"],
        ["42", "right_stick_left"],
        ["41", "right_stick_down"]
      ],
      "socd": [
        ["left_stick_left", "left_stick_right", "second_input"],
        ["left_stick_up", "left_stick_down", "second_input"],
        ["right_stick_left", "right_stick_right", "second_input"],
        ["right_stick_up", "right_stick_down", "second_input"]
      ]
    },
    "fgc": {
      "bindings": [
        ["3", "left_stick_click"],
        ["2", "left_stick_left"],
        ["1", "left_stick_down"],
        ["0", "left_stick_right"],
        ["48", "start"],
        ["32", "left_stick_up"],
        ["33", "my"],
        ["20", "x"],
        ["21", "y"],
        ["22", "left_shoulder"],
        ["23", "right_shoulder"],
        ["16", "a"],
        ["17", "b"],
        ["18", "right_trigger"],
        ["19", "left_trigger"],
        ["40", "right_stick_click"],
        ["43", "left_stick_up"],
        ["42", "left_stick_click"]
      ],
      "socd": [
        ["left_stick_left", "left_stick_right", "neutral"],
        ["left_stick_up", "left_stick_down", "neutral"]
      ]
    },
    "rivals_of_aether": {
      "bindings": [
        ["3", "left_trigger"],
        ["2", "left_stick_left"],
        ["1", "left_stick_down"],
        ["0", "left_stick_right"],
        ["48", "start"],
        ["32", "mx"],
        ["33", "my"],
        ["20", "right_trigger"],
        ["21", "y"],
        ["22", "right_stick_click"],
        ["23", "left_stick_click"],
        ["16", "b"],
        ["17", "x"],
        ["18", "right_shoulder"],
        ["19", "left_stick_up"],
        ["40", "a"],
        ["43", "right_stick_up"],
        ["44", "right_stick_right"],
        ["42", "right_stick_left"],
        ["41", "right_stick_down"]
      ],
      "socd": [
        ["left_stick_left", "left_stick_right", "second_input_no_reactivation"],
        ["left_stick_up", "left_stick_down", "second_input_no_reactivation"],
        ["right_stick_left", "right_stick_right", "second_input_no_reactivation"],
        ["right_stick_up", "right_stick_down", "second_input_no_reactivation"]
      ]
    },
    "rivals_of_aether_2": {
      "bindings": [
        ["3", "left_trigger"],
        ["2", "left_stick_left"],
        ["1", "left_stick_down"],
        ["0", "left_stick_right"],
        ["48", "start"],
        ["32", "mx"],
        ["33", "my"],
        ["20", "right_trigger"],
        ["21", "y"],
        ["22", "left_stick_click"],
        ["23", "left_shoulder"],
        ["16", "b"],
        ["17", "x"],
        ["18", "right_shoulder"],
        ["19", "left_stick_up"],
        ["40", "a"],
        ["43", "right_stick_up"],
        ["44", "right_stick_right"],
        ["42", "right_stick_left"],
        ["41", "right_stick_down"],
        ["50", "select", "hidden"],
        ["49", "home", "hidden"]
      ],
      "socd": [
        ["left_stick_left", "left_stick_right", "second_input_no_reactivation"],
        ["left_stick_up", "left_stick_down", "second_input_no_reactivation"],
        ["right_stick_left", "right_stick_right", "second_input_no_reactivation"],
        ["right_stick_up", "right_stick_down", "second_input_no_reactivation"]
      ]
    },
    "keyboard": {
      "bindings": [
        ["3", "kb_a"],
        ["2", "kb_b"],
        ["1", "kb_c"],
        ["0", "kb_d"],
        ["48", "kb_z"],
        ["32", "kb_e"],
        ["33", "kb_f"],
        ["20", "kb_j"],
        ["21", "kb_k"],
        ["22", "kb_l"],
        ["23", "kb_m"],
        ["16", "kb_n"],
        ["17", "kb_o"],
        ["18", "kb_p"],
        ["19", "kb_q"],
        ["40", "kb_u"],
        ["43", "kb_r"],
        ["44", "kb_t"],
        ["42", "kb_s"],
        ["41", "kb_v"]
      ],
      "socd": [
        ["kb_b", "kb_d", "second_input"],
        ["kb_e", "kb_r", "second_input"]
      ]
    }
  },
  "buttons": [
    ["3", 8.2, 14],
    ["2", 17.7, 7.99],
    ["1", 26.48, 2.88],
    ["0", 35.02, 9.25],
    ["48", 1.28, 1.49],
    ["32", 32.43, 39.92],
    ["33", 37.36, 48.64],
    ["20", 51.43, 12.2],
    ["21", 59.24, 6.04],
    ["22", 69.59, 1.97],
    ["23", 80.9, 1.67],
    ["16", 57.51, 21.34],
    ["17", 64.89, 14.23],
    ["18", 74.82, 11.84],
    ["19", 86.25, 14.96],
    ["40", 61.9, 41.3],
    ["43", 51.01, 33],
    ["44", 60.63, 31.5],
    ["42", 51.79, 42.44],
    ["41", 58.23, 50.62]
  ]
}
