{
  "$schema": "../layout_schema.json",
  "name": "Granola Plateau",
  "deviceName": "Plateau",
  "viewport": [1000, 600],
  "modes": {
    "melee": {
      "bindings": [
        ["48", "start"],
        ["3", "left_trigger"],
        ["2", "left_stick_left"],
        ["1", "left_stick_down"],
        ["0", "left_stick_right"],
        ["4", "dpad_mod"],
        ["32", "mx"],
        ["33", "my"],
        ["20", "right_trigger"],
        ["21", "y"],
        ["22", "light_shield"],
        ["23", "medium_shield"],
        ["16", "b"],
        ["17", "x"],
        ["18", "z"],
        ["19", "left_stick_up"],
        ["40", "a"],
        ["43", "right_stick_up"],
        ["44", "right_stick_right"],
        ["42", "right_stick_left"],
        ["41", "right_stick_down"]
      ],
      "socd": [
        ["left_stick_left", "left_stick_right", "second_input_no_reactivation"],
        ["left_stick_up", "left_stick_down", "second_input_no_reactivation"],
        ["right_stick_left", "right_stick_right", "second_input_no_reactivation"],
        ["right_stick_up", "right_stick_down", "second_input_no_reactivation"]
      ]
    },
    "project_m": {
      "bindings": [
        ["48", "start"],
        ["3", "left_trigger"],
        ["2", "left_stick_left"],
        ["1", "left_stick_down"],
        ["0", "left_stick_right"],
        ["4", "dpad_mod"],
        ["32", "mx"],
        ["33", "my"],
        ["20", "right_trigger"],
        ["21", "y"],
        ["22", "light_shield"],
        ["23", "dpad_up"],
        ["16", "b"],
        ["17", "x"],
        ["18", "z"],
        ["19", "left_stick_up"],
        ["40", "a"],
        ["43", "right_stick_up"],
        ["44", "right_stick_right"],
        ["42", "right_stick_left"],
        ["41", "right_stick_down"]
      ],
      "socd": [
        ["left_stick_left", "left_stick_right", "second_input_no_reactivation"],
        ["left_stick_up", "left_stick_down", "second_input_no_reactivation"],
        ["right_stick_left", "right_stick_right", "second_input_no_reactivation"],
        ["right_stick_up", "right_stick_down", "second_input_no_reactivation"]
      ]
    },
    "ultimate": {
      "bindings": [
        ["48", "start"],
        ["3", "left_trigger"],
        ["2", "left_stick_left"],
        ["1", "left_stick_down"],
        ["0", "left_stick_right"],
        ["4", "dpad_mod"],
        ["32", "mx"],
        ["33", "my"],
        ["20", "right_trigger"],
        ["21", "y"],
        ["22", "right_shoulder"],
        ["23", "left_shoulder"],
        ["16", "b"],
        ["17", "x"],
        ["18", "right_shoulder"],
        ["19", "left_stick_up"],
        ["40", "a"],
        ["43", "right_stick_up"],
        ["44", "right_stick_right"],
        ["42", "right_stick_left"],
        ["41", "right_stick_down"]
      ],
      "socd": [
        ["left_stick_left", "left_stick_right", "second_input"],
        ["left_stick_up", "left_stick_down", "second_input"],
        ["right_stick_left", "right_stick_right", "second_input"],
        ["right_stick_up", "right_stick_down", "second_input"]
      ]
    },
    "fgc": {
      "bindings": [
        ["48", "start"],
        ["3", "left_stick_click"],
        ["2", "left_stick_left"],
        ["1", "left_stick_down"],
        ["0", "left_stick_right"],
        ["4", "left_stick_up"],
        ["32", "left_stick_up"],
        ["33", "my"],
        ["20", "x"],
        ["21", "y"],
        ["22", "right_shoulder"],
        ["23", "left_shoulder"],
        ["16", "a"],
        ["17", "b"],
        ["18", "right_trigger"],
        ["19", "left_trigger"],
        ["40", "right_stick_click"],
        ["43", "left_stick_up"],
        ["42", "left_stick_click"]
      ],
      "socd": [
        ["left_stick_left", "left_stick_right", "neutral"],
        ["left_stick_up", "left_stick_down", "neutral"]
      ]
    },
    "rivals_of_aether": {
      "bindings": [
        ["48", "start"],
        ["3", "left_trigger"],
        ["2", "left_stick_left"],
        ["1", "left_stick_down"],
        ["0", "left_stick_right"],
        ["4", "dpad_mod"],
        ["32", "mx"],
        ["33", "my"],
        ["20", "right_trigger"],
        ["21", "y"],
        ["22", "right_stick_click"],
        ["23", "left_stick_click"],
        ["16", "b"],
        ["17", "x"],
        ["18", "right_shoulder"],
        ["19", "left_stick_up"],
        ["40", "a"],
        ["43", "right_stick_up"],
        ["44", "right_stick_right"],
        ["42", "right_stick_left"],
        ["41", "right_stick_down"]
      ],
      "socd": [
        ["left_stick_left", "left_stick_right", "second_input_no_reactivation"],
        ["left_stick_up", "left_stick_down", "second_input_no_reactivation"],
        ["right_stick_left", "right_stick_right", "second_input_no_reactivation"],
        ["right_stick_up", "right_stick_down", "second_input_no_reactivation"]
      ]
    },
    "rivals_of_aether_2": {
      "bindings": [
        ["48", "start"],
        ["3", "left_trigger"],
        ["2", "left_stick_left"],
        ["1", "left_stick_down"],
        ["0", "left_stick_right"],
        ["4", "dpad_mod"],
        ["32", "mx"],
        ["33", "my"],
        ["20", "right_trigger"],
        ["21", "y"],
        ["22", "left_stick_click"],
        ["23", "left_shoulder"],
        ["16", "b"],
        ["17", "x"],
        ["18", "right_shoulder"],
        ["19", "left_stick_up"],
        ["40", "a"],
        ["43", "right_stick_up"],
        ["44", "right_stick_right"],
        ["42", "right_stick_left"],
        ["41", "right_stick_down"],
        ["50", "select", "hidden"],
        ["49", "home", "hidden"]
      ],
      "socd": [
        ["left_stick_left", "left_stick_right", "second_input_no_reactivation"],
        ["left_stick_up", "left_stick_down", "second_input_no_reactivation"],
        ["right_stick_left", "right_stick_right", "second_input_no_reactivation"],
        ["right_stick_up", "right_stick_down", "second_input_no_reactivation"]
      ]
    },
    "keyboard": {
      "bindings": [
        ["48", "kb_h"],
        ["3", "kb_a"],
        ["2", "kb_b"],
        ["1", "kb_c"],
        ["0", "kb_d"],
        ["32", "kb_e"],
        ["33", "kb_f"],
        ["20", "kb_j"],
        ["21", "kb_k"],
        ["22", "kb_l"],
        ["23", "kb_m"],
        ["16", "kb_n"],
        ["17", "kb_o"],
        ["18", "kb_p"],
        ["19", "kb_q"],
        ["40", "kb_u"],
        ["43", "kb_r"],
        ["44", "kb_t"],
        ["42", "kb_s"],
        ["41", "kb_v"]
      ],
      "socd": [
        ["kb_b", "kb_d", "second_input"],
        ["kb_e", "kb_r", "second_input"]
      ]
    }
  },
  "buttons": [
    ["48", 45.47, 15.66],
    ["3", 7, 13.64],
    ["2", 15.83, 9.37],
    ["1", 25.64, 10.21],
    ["0", 34.48, 15.74],
    ["4", 29.06, 0.77],
    ["32", 32.01, 40.1],
    ["33", 39.47, 47.43],
    ["20", 55.88, 8.11],
    ["21", 63.64, 1.49],
    ["22", 72.9, 0.11],
    ["23", 82.64, 4.2],
    ["16", 56.18, 18.27],
    ["17", 64.78, 11.9],
    ["18", 74.52, 9.73],
    ["19", 83.72, 14.48],
    ["40", 56.9, 38.47],
    ["43", 52.7, 29.03],
    ["44", 62.5, 29.94],
    ["42", 46.5, 37.27],
    ["41", 50.59, 46.53]
  ]
}
